{
  "$schema": "https://json-schema.org/draft/2020-12/schema",
  "$id": "https://github.com/wukong-skills-market/schemas/skill.schema.json",
  "title": "Skill Manifest",
  "type": "object",
  "required": ["id", "name", "description", "version", "entrypoint", "tags"],
  "additionalProperties": false,
  "properties": {
    "$schema": { "type": "string" },
    "id": { "type": "string", "pattern": "^[a-z0-9]+(?:-[a-z0-9]+)*$" },
    "name": { "type": "string", "minLength": 1 },
    "description": { "type": "string", "minLength": 1 },
    "version": { "type": "string", "pattern": "^\\d+\\.\\d+\\.\\d+$" },
    "entrypoint": { "type": "string", "const": "SKILL.md" },
    "tags": {
      "type": "array",
      "items": { "type": "string", "pattern": "^[a-z0-9]+(?:-[a-z0-9]+)*$" },
      "uniqueItems": true
    },
    "author": { "type": "string", "minLength": 1 },
    "license": { "type": "string", "minLength": 1 },
    "compatibility": {
      "type": "object",
      "additionalProperties": { "type": "string", "minLength": 1 }
    },
    "contents": {
      "type": "object",
      "additionalProperties": false,
      "properties": {
        "scripts": { "type": "string" },
        "references": { "type": "string" }
      }
    }
  }
}
