{
  "$schema": "../../schemas/skill.schema.json",
  "id": "wukong-email",
  "name": "Wukong Email",
  "description": "IMAP/SMTP email automation skill for sending, reading, searching, downloading attachments, marking read, and deleting email.",
  "version": "1.1.0",
  "entrypoint": "SKILL.md",
  "tags": ["email", "smtp", "imap", "ssl", "python", "attachments"],
  "author": "maintainer@example.com",
  "license": "MIT",
  "compatibility": {
    "codexSkills": ">=1.0.0"
  },
  "contents": {
    "scripts": "scripts",
    "references": "references"
  }
}
